{
  "workflow_mode": "PRODUCTION_HANDOFF",
  "project": {
    "id": "project/harmony-study",
    "title": "Harmony Study",
    "version": "1.1.0",
    "status": "READY_FOR_PRODUCTION",
    "creator_id": "creator/test",
    "created_at": "2026-08-11T15:00:00+09:00",
    "updated_at": "2026-08-11T21:00:00+09:00"
  },
  "entry_points": {
    "human_summary": "05_production/creative-direction.md",
    "research_plan": "01_planning/research-plan.yaml",
    "evidence_ledger": "02_evidence/evidence-ledger.jsonl",
    "decision_log": "04_decisions/decision-log.yaml",
    "production_requirements": "05_production/production-requirements.yaml",
    "production_hypotheses": "04_decisions/production-hypotheses.yaml",
    "hypothesis_comparison": "04_decisions/hypothesis-comparison.yaml",
    "prototype_plans": "05_production/prototype-plans.yaml",
    "production_handoff": "05_production/production-handoff.yaml",
    "production_change_requests": "06_governance/production-change-requests.yaml",
    "production_feedback_imports": "07_runtime/production-feedback-imports.jsonl",
    "completion_report": "07_runtime/completion-report.json"
  },
  "access": {
    "classification": "PROJECT_INTERNAL",
    "allowed_agents": ["orchestrator", "production-translator", "validator"]
  }
}
